{"classification":{"state":"STATE_A"},"ledger_before":{"entries":[{"name":"parts_vehicle_registry_id_compat","version":"20260626"},{"name":"vehicle_registry_compat","version":"20260627"},{"name":"lc04_profiles_bootstrap_from_git_20260706","version":"20260807192155"},{"name":"lc04_clerk_profile_bridge_from_git_20260707","version":"20260807192219"},{"name":"lc04_legacy_otp_hardening_from_git_20260628","version":"20260807192344"},{"name":"lc04_sovereign_phone_otp_proof_v1","version":"20260807192451"},{"name":"lc04_clerk_profiles_table_from_git_20260708","version":"20260807192639"},{"name":"lc04_clerk_jwt_rls_bridge_from_git_20260709","version":"20260807192655"},{"name":"lc04_atomic_profile_resolver_from_git_20260710","version":"20260807192716"},{"name":"lc04_tiger_sovereign_trust_fabric_20260807094000","version":"20260807192813"},{"name":"lc04_tiger_sovereign_runtime_atomicity_20260807104500","version":"20260807193020"},{"name":"lc04_tiger_sovereign_owner_stepup_20260807173000","version":"20260807193101"},{"name":"lc01_v13_1_authorization_foundation_from_v14","version":"20260807200814"},{"name":"lc01_v14_marketplace_foundation_source_rehearsal","version":"20260807201023"},{"name":"lc01_v14_marketplace_hardening_source_rehearsal","version":"20260807201039"},{"name":"lc03_supabase_security_hardening","version":"20260807221820"},{"name":"lc03_supabase_security_hardening","version":"20260807221821"},{"name":"lc03_supabase_security_hardening","version":"20260807221952"},{"name":"lc03_supabase_security_hardening","version":"20260807222033"},{"name":"staging_remove_legacy_tsrf_ai_otp_objects","version":"20260808163337"},{"name":"tsrf_ai_trust_fabric_20260808130000","version":"20260808163508"},{"name":"tsrf_ai_runtime_atomicity_20260808131000","version":"20260808163601"},{"name":"tsrf_owner_authorization_leases_20260808132000","version":"20260808163633"},{"name":"phone_otp_challenges_20260808133000","version":"20260808163703"},{"name":"lc04_production_legacy_rpc_hardening_staging_proof","version":"20260808170057"},{"name":"lc05_credential_surface_isolation_staging_proof","version":"20260808172415"},{"name":"lc06_rls_performance_hardening_staging_proof","version":"20260808174515"},{"name":"identity_01_fail_closed_profile_resolver_staging_proof","version":"20260808211445"},{"name":"global_launch_phase_a_identity_convergence_runtime_proof","version":"20260808212749"}],"phase_b_present":false},"schema_before":{"canonical":true,"fingerprint":{"authority_rows_zero":true,"bucket_contract":{"allowed_mime_types":["image/jpeg","image/png","image/webp"],"file_size_limit":10485760,"public":false},"evaluator_commit":"24d8bfc8466d7bd251b45b4908f879e47a6f3d43","evaluator_result":{"canonical":true,"failures":[]},"marketplace_rows_zero":true,"projection_file":"schema-before-projection.json","projection_sha256":"7384ca2d425f5b232ed9c762858292e76886a1916f5481b6d44f912b9cee3a90","source_query_blob_sha":"3104cb2dd0401b3076ee947716411b5ab9598daa","target_index_count":7,"target_policy_count":14,"target_table_count":12,"target_trigger_count":5}},"staging_identity":{"branch_name":"lc04-sovereign-staging-20260807","healthy":true,"parent_project_ref":"zelcngyyvbomuzokvuxo","production_project_ref":"zelcngyyvbomuzokvuxo","production_ref_equal":false,"project_ref":"mduummtnlupktjaujgyx"}}
